<fran:FLNffg xmlns:fran="https://france193.wordpress.com"
             xmlns:xsi="http://www.w3.org/2001/XMLSchema-instance"
             xsi:schemaLocation="https://france193.wordpress.com ../xsd/nffgVerifier.xsd"
             name="nffg0" last_updated_time="2008-09-29T03:49:45">

    <!-- in link, destination_node must refers to an existiong node -->
    <!-- link id must be unique in a nffg -->

    <!-- link id must be unique in a node (already done) -->
    <!-- node id must be unique in nffg (already done) -->

    <fran:FLNode name="node0" functional_type="NAT">
        <fran:FLLink name="link0" destination_node="node1"/>
        <fran:FLLink name="link1" destination_node="node2"/>
    </fran:FLNode>

    <fran:FLNode name="node1" functional_type="MAIL_SERVER">
        <fran:FLLink name="link2" destination_node="node1"/>
        <fran:FLLink name="link3" destination_node="node2"/>
        <fran:FLLink name="link4" destination_node="node3"/>
    </fran:FLNode>

    <fran:FLNode name="node2" functional_type="MAIL_SERVER"/>

    <fran:FLNode name="node3" functional_type="MAIL_SERVER"/>

</fran:FLNffg>